title,author,permalink,body
"Nancy Pelosi Has Amassed ~$200 Million Since First Becoming SOTH in 2007. Liberals, Do You Think This Is Ethical?",Own_Palpitation_8477,/r/Askpolitics/comments/1hcmrgi/nancy_pelosi_has_amassed_200_million_since_first/,"As the title says, how do folks who see their party as not nearly as corrupt as Republicans deal with this? Is it okay for a politician to enrich themselves so much while in office?  "
Have the Trump supporters around you gotten quiet?,SteveinTenn,/r/Askpolitics/comments/1hgqny2/have_the_trump_supporters_around_you_gotten_quiet/,Mine have suddenly lost interest in discussing politics. Or egg prices. Or wars. As the inauguration nears they’ve pretty much gone silent and deep. We got one day of “God gave us Trump back!” then nothing. Especially as the cabinet nominees have been announced. 
"With Trump banning trans people from the military, would it be possible to dodge the draft by claiming to be trans?",MisterFyre,/r/Askpolitics/comments/1hl2dpt/with_trump_banning_trans_people_from_the_military/,
"Elon Musk is $70,000,000,000 richer since supporting donald Trump. Conservatives, Do You Think This Is Ethical?",hotdogman200,/r/Askpolitics/comments/1hcssgg/elon_musk_is_70000000000_richer_since_supporting/,"Keep in mind he is not just a donor, he is now the head of DOGE allowing him to influence government policies to benefit his companies specifically. edit- IE ""Trumps transition team wanting to repeal the requirement that companies report automated vehicle crash data, when Teslas have the highest reported crashes due to automation"". Shouldn't musk spend time making his cars automation safer instead of getting the government to hide how unsafe they are?

  
[Exclusive: Trump team wants to scrap car-crash reporting rule that Tesla opposes | Reuters](https://www.reuters.com/business/autos-transportation/trump-transition-recommends-scrapping-car-crash-reporting-requirement-opposed-by-2024-12-13/)"
"For all of the people who claim California is terrible, have you ever been to California?",Advanced_Aspect_7601,/r/Askpolitics/comments/1hn3z7a/for_all_of_the_people_who_claim_california_is/,"I've noticed California has kind of become the easy target of ideological attacks about what is wrong with the US politically. Sort of a geographic hotspot of what is the antithesis of all that is good and holy in right wing political groups.

I wonder though. How many of the people claiming this have actually either been to or met anyone from California. What is informing your opinion on the matter?

I know podcasters like Joe Rogan left the State in a public way, but to be fair his takes are more about places like Los Angeles... And anyone who has been to the state knows that's there is a lot more going on there besides LA."
"Trump voters, did you believe Trump when he said he didn’t know anything about Project 2025?",Snarkasm71,/r/Askpolitics/comments/1gxon1k/trump_voters_did_you_believe_trump_when_he_said/,"Now that Donald Trump has nominated the architect of Product 2025, Russell Vought, to lead the Office of Management and Budget, it’s pretty clear Trump was aware of Project 2025. "
"In light of Joe Biden pardoning Hunter, why did the Saudis give Jared Kushner $2B?",Hot_Cryptographer552,/r/Askpolitics/comments/1h4olop/in_light_of_joe_biden_pardoning_hunter_why_did/,
Trump Supporters - How Are You Feeling About The Cabinet Picks So Far?,chewbaccasaux,/r/Askpolitics/comments/1grgs4c/trump_supporters_how_are_you_feeling_about_the/,"As an (apparently out of touch) liberal democrat, I'm wondering if people who voted for Trump were expecting these types of nominees?  I see them as wholly unqualified and shockingly unfit but - I'm trying to learn here - is this what the 'we want change' America wanted?  Are these nominees checking your box for your need for disruptive change?  I'm seriously trying to understand."
"Conservatives, how do you feel about trump admitting tariffs will raise prices?",themontajew,/r/Askpolitics/comments/1h9tu5l/conservatives_how_do_you_feel_about_trump/,"Now that everyone seems on the same page of how tariffs effect inflation c do you feel lied to, did you know this was going to be the case, does this change anything for you?

Edit: we know tariffs raise prices, ya'll don't need to explain that. I'm asking how you feel about trump lying about it. I saw all the ""trump low prices, harris high prices"" yard signs."
Do people actually believe that racism and misogyny are the reasons why Kamala Harris lost?,Feeling-Currency6212,/r/Askpolitics/comments/1h1kc07/do_people_actually_believe_that_racism_and/,For the liberals or anyone who voted for Kamala Harris: why do you think that she lost the election to Donald Trump?
How did Joe Biden go from 81 million votes to becoming the most unpopular president since Jimmy Carter?,[deleted],/r/Askpolitics/comments/1hqkm3a/how_did_joe_biden_go_from_81_million_votes_to/,"The last 4 years have been something. We saw Biden receive the most votes of any candidate in American history, only to absolutely fumble that in the most extraordinary way possible, becoming the least popular president since Carter. 

How did this happen and how can Democrats recover the goodwill of the American people?

(FiveThirty Eight https://projects.fivethirtyeight.com/biden-approval-rating/ ) 
"
Jimmy Carter has died. Let’s take a moment and praise him?,[deleted],/r/Askpolitics/comments/1hp6gu8/jimmy_carter_has_died_lets_take_a_moment_and/,"As the title suggests, can we even briefly say something positive without anything negative?

I think he was the most decent human to ever serve as president. I also was in ROTC for most of his presidency and was very proud to serve under him. "
"MAGA supporters and Republicans, what do you think of Trump back tracking on lowering grocery prices?",DreamLunatik,/r/Askpolitics/comments/1hco8s7/maga_supporters_and_republicans_what_do_you_think/,"Today it was reported https://www.reddit.com/r/politics/s/LkfZEJXN15 

Thoughts? "
Trump ‘24 voters who previously voted for Obama and/or Biden: what drove your decision this time?,windsurferk,/r/Askpolitics/comments/1h14fyg/trump_24_voters_who_previously_voted_for_obama/,
"If Trump is going to cut waste, why did he increase the debt by 3.4 trillion (excluding pandemic) during his first term?",[deleted],/r/Askpolitics/comments/1h2mi7r/if_trump_is_going_to_cut_waste_why_did_he/,
Why does this subreddit constantly flame republicans for answering questions intended for them?,[deleted],/r/Askpolitics/comments/1h2csln/why_does_this_subreddit_constantly_flame/,"Every time I’m on here, and I looked at questions meant for right wingers (I’m a centrist leaning right) I always see people extremely toxic and downvoting people who answer the question. What’s the point of asking questions and then getting offended by someone’s answer instead of having a discussion?

Edit: I appreciate all the awards and continuous engagements!!!"
Why do people think republicans are better at managing the economy?,Formal_Lie_713,/r/Askpolitics/comments/1gvegnc/why_do_people_think_republicans_are_better_at/,"In my lifetime I remember Bill Clinton’s term ending with a budget surplus, and George W. Bush’s term ending with the Great Recession. Reagan added millions to the deficit. Trump had huge spending bills while also cutting taxes. Why do Americans still think republicans are better at the economy?"
"Conservatives, are you excited about Donald Trump taking office?",MsMcSlothyFace,/r/Askpolitics/comments/1hrxcpb/conservatives_are_you_excited_about_donald_trump/,"Do you believe he will fix inflation, immigration, housing crisis, etc? Are you a trump supporter (maga) or did you vote for him solely because he was the republican candidate?"
To Trump voters: why did Trump's criminal conduct not deter you from voting for him?,Ok-Profit-1935,/r/Askpolitics/comments/1h6z7sa/to_trump_voters_why_did_trumps_criminal_conduct/,"Genuinely asking because I want to understand.

What are your thoughts about his felony convictions, pending criminal cases, him being found liable for sexual abuse and his perceived role in January 6th?

Edit: never thought I’d make a post that would get this big lol. I’ve only skimmed through a few comments but a big reason I’m seeing is that people think the charges were trumped up, bogus or part of a witch hunt. Even if that was the case, he was still found guilty of all 34 charges by a jury of his peers. So (and again, genuinely asking) what do you make of that? Is the implication that the jury was somehow compromised or something? "
"Trump got 63M votes in 2016, 74M in 2020, and 76M in 2024. If he's as bad as you claim, why is his votes increment?",[deleted],/r/Askpolitics/comments/1gs7qt0/trump_got_63m_votes_in_2016_74m_in_2020_and_76m/,I would like a genuine answer. 
Why do democrat supporters refuse to accept the party made made mistakes resulting in trumps win?,ExcellentLaw2066,/r/Askpolitics/comments/1gx61zg/why_do_democrat_supporters_refuse_to_accept_the/,"I've noticed a growing resistance to accept blame from democrat supporters (r/politics) especially. Democrat supporters refuse to discuss or accept that the Harris campaign made major mistakes that turned off voters or made voters not want to come out and vote. I believe this election really traumatized people and broke a lot of Redditors brains, whether they admit it or not.

They seem to take accepting responsibility for failure as an endorsement of trumps behavior, which is odd.

What do you think is causing this?

Edit: the irony is democrats are still defending a losing strategy in this post. 

Edit 2: The fact that so many of my fellow Harris supporters are asking for what constitutes a losing strategy is hilarious. ""What mistakes?"". 10million fewer democrats didn't decide to randomly not vote. 

Mistakes such as:
- She should have distanced herself from Biden
- She should have made stronger points about improving the economy
- less celebrity endorsement, more working class town halls
- saying no substantial  difference on Gaza which alienated Arab Michigan voters 
- focusing on illegals immigration before it became a concern to her campaign late in the game 
- her weird laughter and lack of charisma(aka Howard Dean scream, despite being a silly issue did bother people )
- cozying up to billionaires and receiving donations from big pharma which, as the NYT said, limited her ability to criticize those groups 

""Scratch a liberal and a fascist bleeds"" is so true.

Lots of willful ignorance, congrats guys you've distanced moderates in this thread. When they called him Drumpf I rolled my eyes. Just like when they thought ""weird"" was the kryptonite. Maybe name calling isn't the answer?

I don't know if I'll vote dem again when the party I've voted for since I was first able to during Obama's second term has changed. Maybe independent🤔

One of the top commments called the Harris campaign ""flawless""😭.

Make it make sense...

Edit 3: lol if you can only point to trump being worse instead of discussing the criticisms of the Harris campaigns like this thread is about; you're just proving why he deserved to win.👍

Edit4: ELECTIONS HAVE CONSEQUENCES. 

"
"Why is Biden planning on pardoning Fauci, Cheney and Schiff if supposedly they did nothing wrong?",LetsFuckOnTheBoat,/r/Askpolitics/comments/1h86etw/why_is_biden_planning_on_pardoning_fauci_cheney/,
Why do Conservatives trust Elon?,HappyBlowLucky,/r/Askpolitics/comments/1hhjici/why_do_conservatives_trust_elon/,"He's EXTRODINARILY wealthy and is being charged with potentially eliminating any regulation which would hamper his ability to continue amassing wealth. He has immense clout particularly through his use of X as a communication/propaganda machine. Asking those only on the Right, what makes this situation seem at all safe from corruption and likely to benefit The People at least as much as it will likely benefit Elon?"
Do you think AOC removing her pronouns from her social media bios is a sign of where the Dems want to go politically?,ImGettinThatFoSho,/r/Askpolitics/comments/1grxn88/do_you_think_aoc_removing_her_pronouns_from_her/,
Those on the right - anyone embarrassed that Gaetz was Trump’s first AG pick?,fainting_goat_games,/r/Askpolitics/comments/1hkpqze/those_on_the_right_anyone_embarrassed_that_gaetz/,In light of the ethics report being leaked - this seemed a good time for this question. Relevant link: https://www.cnn.com/2024/12/23/politics/matt-gaetz-house-ethics-report/index.html
What are your thoughts on AOC when she opened dialog with Trump voters?,meandering_simpleton,/r/Askpolitics/comments/1h3f70k/what_are_your_thoughts_on_aoc_when_she_opened/,"My opinion of AOC skyrocketed this election when she started a genuine conversation with Trump voters to understand their motivations. I'm interested to hear both from conservatives and liberals on this. What do you think of her doing this, and why dont more politicians try to understand the other side?

I hope more of our politicians can follow this example to understand people on the other side of the aisle without vilifying them."
Has your opinion of Kamala Harris changed post-election?,[deleted],/r/Askpolitics/comments/1hgvrmw/has_your_opinion_of_kamala_harris_changed/,"She’s not my favorite, but she has gained quite a bit of respect from me post-election. She has been very graceful and hopeful. She respects the election, which is a breath of fresh air. She’s done a very good job at calming the nerves of her party while still remaining focused on the future. Some of her speeches have been going around on socials, and she’s even made me giggle a few times. She seems very chill but determined, and she seems like a normal human being. I wish I saw that more in her campaign. Maybe I wasn’t looking or there wasn’t enough time. Democrats seem to love her, and it’s starting to make more sense to me. It’s safe to say it’s not the last time we see her. 


Edit: I should’ve been more clear. Has she changed the way you see her as a human? Obviously she’s not gonna change your politics. I feel like she’s been painted as an evil lady with an evil witch laugh, and I kinda fell for it. I do think this country would be a much better united place if everybody acted like she has after a big loss. We haven’t seen that in a while. "
How do you feel that Trump and Elon are advocating for removing the debt ceiling?,mlamping,/r/Askpolitics/comments/1hiepbz/how_do_you_feel_that_trump_and_elon_are/,"To the fiscal conservatives, tea party members, debt/deficit hawks etc…

How do you feel about this? 

Especially those who voted for trump because of inflation?"
How did the Harris Campaign raise $1 billion and end up with $20 million in debt during a 3 month time span?,Feeling-Currency6212,/r/Askpolitics/comments/1gq5hfj/how_did_the_harris_campaign_raise_1_billion_and/,"Obviously, the money advantage didn’t matter but like I said there was really bad management of the campaign’s finances."
"Conservatives, do you believe corporations will do the right thing without gov regulations?",deca4531,/r/Askpolitics/comments/1hl3aht/conservatives_do_you_believe_corporations_will_do/,"The new administration has said they want to get rid of the FDA and cut government regulations. This is going to make a lot of companies a lot of money but what is it going to do for us? Do you expect them to pass the saving to the customer or raise wages? If no law forbid it do you believe that companies wouldn't put lead, carcinogens, and poisons in their products?"
"With Gaetz withdrawing, I have to ask: why is Trump immune to attacks on his unethical behavior, but others aren't?",[deleted],/r/Askpolitics/comments/1gww9en/with_gaetz_withdrawing_i_have_to_ask_why_is_trump/,"This ""phenomenon,"" for lack of a better word, is baffling to me. Trump was convicted in court for hiding a hush money payment to Stormie Daniels, a porn star, that he had sex with while married. He also lost a defamation case brought up by E. Jean Carroll, when he denied allegations that he sexually assaulted her. So US courts have officially ruled that Trump is a rapist and buys prostitutes, exactly the allegations against Gaetz. And yet Gaetz is drummed out of Congress for his actions by his own party.

I'm sure this question has come up before and has been answered, but I feel like the time is right to bring it up again.

Edit: After examining all the answers, these are the best ones that made sense to me:

1. Trump isn't affected by shame, and he deflects all his attacks by turning the mirror on his opponents, who are often slightly if not fully corrupt as well. This justifies him in the eyes of his supporters. Furthermore, he makes himself such a controversial character that the media and the government have a hard time keeping up with him to hold him accountable.
2. He's also a powerhouse in the GOP now, and others who don't have quite as big of a backing are easily thrown under the bus by the party.

In summary: American politics are f*cked.

Edit 2: Other answers I see.

""MAGA is a cult""

While I don't deny the fervor of his base, especially considering some of the replies that I'm getting, I do not believe that the establishment GOP sees him that way, else Gaetz would've never run into such an issue.

""The system is rigged against him and people see through it.""

If so, how was he able to delay all the election interference cases, and the sentencing on the Stormie Daniels case, against him until past the election, and then win the election? Why would a system that is rigged against him even allow him the chance to be reelected?

""He didn't pay Stormie Daniels for sex, he just paid her to stay silent."" 

And 

""He isn't guilty of raping E. Jean Carroll, he's guilty of defaming her.""

You're making excuses for him and proving my point, honestly.

""Trump was elected, not appointed.""

Yes, but he's still subject to impeachment, which he was able to get out of twice, clearly because the GOP sees that he wins elections.

""Gaetz was a smokescreen.""

Then why did Gaetz withdraw before the Senate even began the confirmation process? If Gaetz was just supposed to distract people from his other picks, then he should've stayed in."
Why is Trump's plan to end birtright citizenship so controversal when other countries did it?,Ariel0289,/r/Askpolitics/comments/1hauodx/why_is_trumps_plan_to_end_birtright_citizenship/,"Many countries, including France, New Zealand, and Australia, have abandoned birthright citizenship in the past few decades.2 Ireland was the last country in the European Union to follow the practice, abolishing birthright citizenship in 2005.3

**Update:**

I have read almost all the responses. A vast majority are saying that the controversy revolves around whether it is constitutional to guarantee citizenship to people born in the country.

My follow-up question to the vast majority is: if there were enough votes to amend the Constitution to end certain birthrights, such as the ones Trump wants to end, would it no longer be controversial?"
"Why is Reddit far more ""left-wing"" than real life?",RabidRomulus,/r/Askpolitics/comments/1h9l3vp/why_is_reddit_far_more_leftwing_than_real_life/,"Coming from a center left person. 

Check out [r/Idaho](https://www.reddit.com/r/Idaho/top/?t=year), [r/NorthDakota](https://www.reddit.com/r/northdakota/top/?t=year), or [r/Oklahoma](https://www.reddit.com/r/oklahoma/top/?t=year) and sort by top this past year. 

Most of the top posts are political - pro Democrat/Harris or anti Republican/Trump. Any remotely positive Trump/Republican comments are down voted to hell.

Yet, in all 3 of these states Trump won by OVER 65%, and Republicans won every single house seat. It wasn't even close. 

How is this possible to this extreme? Is it reddit demographics? Bots/manipulation? Other factors?"
"I keep seeing claims that Elon Musk is the one calling the shots and Trump is his puppet, do you think this is the case?",[deleted],/r/Askpolitics/comments/1hjfx4p/i_keep_seeing_claims_that_elon_musk_is_the_one/,"As per the title, what do you think? I have a lot of thoughts on this but they are still forming at the moment and I need more time/data. But the left seems to be screaming this from the rooftops and at the moment Elon does seem to have a lot of power from his bully pulpit (X). I am wondering if this is a strategy they are using together or if Elon is acting more independently than Trump might prefer.  
  
So what do you guys think? Where do you think this goes from here?   
  
 "
Why is Reddit so left-wing?,IamTheMan85,/r/Askpolitics/comments/1g3o8n3/why_is_reddit_so_leftwing/,"Serious question. Almost all of the political posts I see here, whether on political boards or not, are very far left leaning. Also, lots of up votes for left leaning posts/comments, where as conservative opinions get downvoted.

So what is it about Reddit that makes it so left-wing? I'm genuinely curious. 

Note: I'm not espousing either side, just making an observation and wondering why."
Why Reddit is so left leaning?,Think_Bee_1766,/r/Askpolitics/comments/1gjh34n/why_reddit_is_so_left_leaning/,"This article might explain why everyone on Reddit seems to be so far left. It doesn't make sense because it's much more divided on every other social media platform except reddit.

https://thefederalist.com/2024/10/29/busted-the-inside-story-of-how-the-kamala-harris-campaign-manipulates-reddit-and-breaks-the-rules-to-control-the-platform/"
Will history view Merrick Garland as the worst AG in history?,Tmettler5,/r/Askpolitics/comments/1guqz6k/will_history_view_merrick_garland_as_the_worst_ag/,"https://www.usnews.com/opinion/articles/2024-11-18/forget-matt-gaetz-merrick-garland-is-americas-worst-attorney-general

This opinion piece makes a compelling argument for that very idea. What are your thoughts? 


Edit: It looks like Matt Gaetz is stepping down. 11/21"
Republicans / Trump voters: What values do you think the Democrats are trying to attack?,[deleted],/r/Askpolitics/comments/1gzms3i/republicans_trump_voters_what_values_do_you_think/,"For the life of me I don’t know what posts / comments about democratic persecution of republicans could be talking about besides “Don’t use the R word.”

From my perspective, the democratic positions are “be kind to people who are different from you” (trans people, gay people, etc), while the Republican positions are specifically geared towards limiting individual freedoms and expressions.

I’m just so confused. What exactly are the democrats trying to take away, or dismantle, or rob republicans of?

**Edit:**

Thanks for all the responses!

Except for the ones that don’t even attempt to discuss this, or the Democrats out there telling me what they think about this question. I don’t really care why you think they voted for Trump. Wasn’t the question and the question wasn’t for you!

I went for a long time but I can’t go forever so I’m taking a break. Here’s a short summary so far:

Seems like for the most part the Trump voters who answered didn’t vote for Trump because they disagreed with democratic policies or because they supported Trump. It appears that responders voted for Trump because they were tired of being bitched at and told they were wrong online.

Some had other more salient points like: 

“Gay marriage is an attack on the nuclear family.”

“Trans women shouldn’t be able to play sports with women.”

“Donald Trump will fix inflation.”

“DEI is bad.”

Some I asked for clarity. Some I bitched at and told them they were wrong.

Anyway, it’s so fucking sad and morally questionable to vote for an adjudicated rapist because somebody called you mean online.

Grow some skin.

**Edit 2:**

A mod was kind enough to request I edit some of the more inflammatory wording in my edit, so I obliged as I’d rather change the post than have it taken down. I think some of the discourse below is helpful and important.

Some.

**Edit 3:**

I’m probably done for the night. Thanks to some of you for the earnest, honest, good faith conversations. To more of you, 🙄🤷‍♂️. What did I expect I guess?

To the non-Trump voters **STILL** answering with your fan fictions: did you miss the first edit? **I don’t care lmao**. This question wasn’t for you; it was for Trump voters. I care about your opinions for sure, just as much as I care about any human’s opinion, but come on lol. I feel like all the pontificating and asserting about what the Trump voter believes or thinks is pushing them even further away. Like my general attitude probably is lol.

Instead of typing what you think about all this go read what they said. It’s enlightening. Sometimes depressing, often confusing or infuriating, occasionally heartwarming. Go read it. Reply to it. Ask questions. It’s why I asked in the first place. So we could learn, and maybe talk and reach some common ground.

I’m way far left, and fiercely defendant of all peoples’ individual rights - theirs included - so I’m just going to piss most of them off. Maybe you won’t. Let’s bridge the gap. Uh… sorry. Y’all bridge the gap. I’m gunna go call someone a selfish fuck troll and go to bed.

o7"
