title,author,permalink,body
Donald Trump has announced US strikes against Iranian nuclear sites. What comes next?,Objective_Aside1858,/r/PoliticalDiscussion/comments/1lhb317/donald_trump_has_announced_us_strikes_against/,"It is unclear at this point what damage was done, but it should be expected that Iran will feel obligated to retaliate in some way. 

If the nuclear sites are sufficiently damaged, will the United States accept the retaliation without further escalation?"
Why would we choose to end the legal status of over 500k people who have been here for at least 15 years?,The3mbered0ne,/r/PoliticalDiscussion/comments/1lvk7gl/why_would_we_choose_to_end_the_legal_status_of/,"At least 63% of the Honduran's, 51% Salvadorians, 16% Haitians and 61% Nicaraguan's [have been here for over 20 years](https://www.americanimmigrationcouncil.org/wp-content/uploads/2025/01/temporary_protected_status_in_the_united_states.pdf) and have over 270k children (combined) who are citizens

Over 80% have jobs and over 30% have mortgages why would we remove their TPS when they are active valued members of our community and clearly are invested in our future? What's going to happen to their children?"
Why did Trump choose Matt Gaetz for Attorney General? ,bunkscudda,/r/PoliticalDiscussion/comments/1gqo32j/why_did_trump_choose_matt_gaetz_for_attorney/,"Matt is technically a lawyer, but never really practiced much. His whole career has been State Rep, then National Rep. thats about it.

I get that Trump just wants loyalists, but there is no comparing Gaetz to Barr in terms of how knowledgable they are with the law or what an AG’s roles and responsibilities entail.  

Realistically, what will a Gaetz DoJ look like?"
"State assemblyman Zohran Mamdani appears to have won the Democratic primary for Mayor of NYC. What deeper meaning, if any, should be taken from this?",Objective_Aside1858,/r/PoliticalDiscussion/comments/1lk1jk6/state_assemblyman_zohran_mamdani_appears_to_have/,"Zohran Mamdani, a 33-year-old state assemblyman and self described Democratic Socialist, appears to have won the New York City primary against former Gov. Andrew Cuomo.

Is this a reflection of support for his priorities? A rejection of Cuomo's past and / or age? What impact might this have on 2026 Dem primaries?"
Kash Patel has been confirmed to lead the FBI. What happens to the agency now?,Kevin-W,/r/PoliticalDiscussion/comments/1iu764n/kash_patel_has_been_confirmed_to_lead_the_fbi/,"The Senate has confirmed Kash Patel to lead the FBI. Patel is a staunch Trump loyalist and has accused the FBI and intelligence agencies of carrying out a “deep state” plot targeting Trump and his allies — including himself — and called for a major overhaul of both.

What happens to the FBI now? There have been fears of him using an “enemies list” to go after Trump’s political and personal enemies. Do you think there will be a mass resignation inside the FBI due to protests?"
"Trump has picked RFK Jr for HHS secretary. Will the Pharma industry lobby hard to block his confirmation and if so, will they succeed?",Kevin-W,/r/PoliticalDiscussion/comments/1grgblk/trump_has_picked_rfk_jr_for_hhs_secretary_will/,"Trump has picked RFK Jr for HHS secretary. This means he would oversee agencies like the CDC and FDA. RFK Jr is well known for being an anti-vaxxer and has advocated removing fluoride from water.

Since the Pharma industry would be heavily affected, do you think they're going to lobby hard to block his confirmation and if they do, will they be successful?"
"The Trump budget bill includes $4.5T in tax cuts, while Musk’s DoGE objective is to only reduce taxes by $2T. How will this affect the economy?",_SilentGhost_10237,/r/PoliticalDiscussion/comments/1iqj7f8/the_trump_budget_bill_includes_45t_in_tax_cuts/,"Trump’s proposed budget bill, currently under consideration in Congress, includes $4.5 trillion in tax cuts over ten years, while Musk’s federal spending reduction goal would cut roughly $2 trillion per year. However, Trump’s budget aims to reduce spending by $2 trillion over ten years. Trump has previously argued that federal spending contributes to inflation, yet his tax plan is projected to increase the deficit by trillions of dollars due to lost revenue. Given that the economy is in a growth phase, could this policy contribute to inflationary pressures? Historically, tax cuts and deficit spending are more common and economically sound during recessions to stimulate demand. What is the strategic rationale for implementing this policy now?"
What would it take to flip republicans against trump?,EpicCow69,/r/PoliticalDiscussion/comments/1jrn7sv/what_would_it_take_to_flip_republicans_against/,"Yesterday trump dropped a butt ton of tariffs and today Dow jones is down 2200 points (not good), let’s not forget plain clothes ICE agents disappearing immigrants but I still hear a lot of republicans saying they support trump both in congress and from voters so what would it take for republicans to flip on trump?"
Trump fired the director of BLS because he got bad job creation numbers. Can future numbers be trusted?,homerjs225,/r/PoliticalDiscussion/comments/1mfapwy/trump_fired_the_director_of_bls_because_he_got/,"Bureau of Labor Statistics publish the monthly job creation numbers. July number was weak and the revisions from May and June were really bad. Trump will now install a toad the old directors position. How will we be able to figure out if the subsequent numbers are lies?

https://www.reuters.com/legal/litigation/trump-fires-bls-commissioner-raising-concerns-about-economic-data-quality-2025-08-01/"
Does JD Vance refusing to admit Trump losing the election concern you?,dorgon15,/r/PoliticalDiscussion/comments/1g1qs25/does_jd_vance_refusing_to_admit_trump_losing_the/,"JD just had an interview with the New York times in which he refused to admit Trump lost the election in 2020 5 times in a row. 

The question matters in regards to the general population ability to trust our election process. Trump's investigation team dug into the 2020 election and found little to no evidence of material that would discredit the election

They lost 63 court cases appealing the election results

My question is do you guys understand why this question is important. And if you are considering Trump does JD refusing to answer this question matter to you? "
Doing away with Electoral College would fundamentally change the electorate,The_B_Wolf,/r/PoliticalDiscussion/comments/1gjy0s5/doing_away_with_electoral_college_would/,"Someone on MSNBC earlier tonight, I think it was Lawrence O'Donnell, said that if we did away with the electoral college millions of people would vote who don't vote now because they know their state is firmly red or firmly blue. I had never thought of this before, but it absolutely stands to reason. I myself just moved from Wisconsin to California and I was having a struggle registering and I thought to myself ""no big deal if I miss this one out because I live in California. It's going blue no matter what. 

I supposed you'd have the same phenomenon in CA with Republican voters, but one assumes there's fewer of them. Shoe's on the other foot in Texas, I guess, but the whole thing got me thinking. How would the electorate change if the electoral college was no longer a thing? "
"Should ""de-Trumpification"" be a requisite plank for a future US presidential candidate?",HeloRising,/r/PoliticalDiscussion/comments/1ns7709/should_detrumpification_be_a_requisite_plank_for/,"Trump has put into place a number of policy and organizational changes that have fundamentally shifted a number of elements of political life in the US.

A lot of these moves have not been popular.

Should an aspiring candidate for the US presidency in the next election make removal/reversal of those changes a key point in their campaign?

How does the calculus change if the aspirant is a Republican vs if they're a Democrat?"
White House has announced Trump's Liberation Day Tariffs will immediately go into effect.  A Moody's simulation found it could be an economic wipe out. Is Trump's Liberation Day Tariffs a Misnomer?,PsychLegalMind,/r/PoliticalDiscussion/comments/1jp4qwq/white_house_has_announced_trumps_liberation_day/,"A Moody's simulation found that a tariff trade war would wipe out 5.5 million jobs, lift the unemployment rate to 7%and cause U.S. GDP to drop by about 1.7%. Trump’s potential 20% universal tariff could spark ""serious"" recession in US, Moody’s economist warns.

The biggest three partners \[China, Canada and Mexico\] have promised immediate retaliation. Economic war could escalate and perhaps even cause a worldwide downturn.  

Perhaps Trump's strategy is to begin making bilateral trade deals, but there are even certain blocks such as EU that may well coordinate retaliation together. I am not aware what Trump is actually liberating us from, hence the question.  

Is Trump's Liberation Day Tariffs a Misnomer?  

"
"Last night a leadup act during Trump's Madison Square Garden rally described Puerto Rico as a ""floating pile of garbage"". There have been multiple press articles about the backlash. Is this likely to have an impact?",Objective_Aside1858,/r/PoliticalDiscussion/comments/1gehaga/last_night_a_leadup_act_during_trumps_madison/,"Comedian Tony Hinchcliffe made the following statement as part of his stand up routine: ""There’s literally a floating island of garbage in the middle of the ocean right now. I think it’s called Puerto Rico.”

  
Why is this comment by someone who is not a core member of Trump's team causing such outrage, when similar comments by Trump have passed almost unacknowledged? 

  
While Puerto Rico does not have a say in the general election, they - once again - will have a (non binding) statehood referendum on their ballot. Will this cause an increase or decrease of support for either requesting statehood or independence?"
As the Trump administration violates multiple federal judge orders do these issues form a constitutional crisis?,The_Egalitarian,/r/PoliticalDiscussion/comments/1jd6cns/as_the_trump_administration_violates_multiple/,"[US deports hundreds of Venezuelans despite court order](https://www.bbc.com/news/articles/cp9yv1gnzyvo)

[Brown University Professor Is Deported Despite a Judge’s Order](https://www.nytimes.com/2025/03/16/us/brown-university-rasha-alawieh-professor-deported.html)

There have been concerns that the new administration, being lead by the first convicted criminal to be elected President, may not follow the law in its aims to carry out sweeping increases to its own power. After the unconstitutional executive order attempting to end birthright citizenship, critics of the Trump administration feared the administration may go further and it did, invoking the Alien Enemies Act to deport over 200 Venezuelans, a country the US is not at war with, to El Salvador, a country currently without due process.

Does the Trump administration's violation of these two judge orders begin a constitutional crisis?

If so what is the Supreme Court likely to do?"
Today the Supreme Court majority ruled to limit the authority of individual judges to issue nationwide injunctions by restricting it to the plaintiffs involved. Will this ruling have a crippling effect on District Courts because they can essentially only rule district by district?,PsychLegalMind,/r/PoliticalDiscussion/comments/1llvh1b/today_the_supreme_court_majority_ruled_to_limit/,"The court held: Universal injunctions likely exceed the equitable authority that Congress has given to federal courts. The Court grants the Government’s applications for a partial stay of the injunctions entered below, but only to the extent that the injunctions are broader than necessary to provide complete relief to each plaintiff with standing to sue.

The Trump Administration has declared it as a major victory. They have consistently argued a single judge should not have vast authority to block actions taken by the Executive. This ruling itself does not involve the merits of the issue of citizenship birth right and does not indicate how the Court may eventually rule. 

Will this ruling have a crippling effect on District Courts because they can essentially only rule district by district? 

[https://www.supremecourt.gov/opinions/24pdf/24a884\_8n59.pdf](https://www.supremecourt.gov/opinions/24pdf/24a884_8n59.pdf)"
"If Trump/Musk are indeed subverting American democratic norms, what is a proportional response?",theivoryserf,/r/PoliticalDiscussion/comments/1irut5o/if_trumpmusk_are_indeed_subverting_american/,"The Vice-President has just said of the courts: ""Judges aren't allowed to control the executive's legitimate power."" Quoted in the same *Le Monde* article is a section of Francis Fukuyama's take on the current situation:

*""Trump has empowered Elon Musk to withhold money for any activity that he, Elon Musk, thinks is illegitimate, and this is a usurpation of the congressionally established power of Congress to make this kind of decision. (...) This is a full-scale...very radical attack on the American constitutional system as we've understood it.""* https://archive.is/cVZZR#selection-2149.264-2149.599

From a European point of view, it appears as though the American centre/left is scrambling to adapt and still suffering from 'normality bias', as though normal methods of recourse will be sufficient against a democratic aberration - a little like waiting to 'pass' a tumour as though it's a kidney stone. 

Given the clear comparisons to previous authoritarian takeovers and the power that the USA wields, will there be an acceptable raising of political stakes from Trump's opponents, and what are the risks and benefits of doing so?"
"How can democrat Ruben Gallego have a nearly 10-point lead in the polls over Trump-candidate Kari Lake for US Senate, and yet Trump is still favored to win Arizona? Are there *that* many people who love Trump but dislike Kari Lake enough to vote for a democrat over her?",DetroitWhat1992,/r/PoliticalDiscussion/comments/1g3p0z6/how_can_democrat_ruben_gallego_have_a_nearly/,"I'm not sure if this happens in other states either, but I can't quite wrap my head around tens or hundreds of thousands of people voting for Trump, but then voting for a democrat over Trump candidate Kari Lake? How is that discrepancy in polling explained?"
How will the United States rebuild positive international relations after this Trump administration?,SpaceySpice,/r/PoliticalDiscussion/comments/1jt937f/how_will_the_united_states_rebuild_positive/,"At some point this presidency will end and a new administration will (likely) want to mend some the damages done with our allies. Realistically though, how would that work? Will other countries want to be friends with us again or has this presidency done too much damage to bounce back from? "
"New WSJ poll shows Democratic Party at lowest favorability in 35 years, why is voter confidence so low?",[deleted],/r/PoliticalDiscussion/comments/1mabrfz/new_wsj_poll_shows_democratic_party_at_lowest/,"My wife showed me this Wall Street Journal poll from earlier this month. Says only 33% of voters view the Democratic Party favorably right now. That’s the worst rating they’ve had in decades.

Even though a lot of people aren’t happy with Trump or the GOP, Democrats are now behind on most of the big issues; economy, immigration, etc. Only areas where they still lead are healthcare and vaccines.

I’ve seen people blame the economy, infighting, weak messaging, or just burnout from both parties. Some think younger voters are tuning out altogether.

What do you think is driving the numbers down? Curious what others are seeing where they live.

Source:
https://www.wsj.com/politics/elections/democratic-party-poll-voter-confidence-july-2025-9db38021"
Is Elon Musk’s Expanding Government Influence a Threat to Democracy?,tardiscoder,/r/PoliticalDiscussion/comments/1ik4ryh/is_elon_musks_expanding_government_influence_a/,"Over the past few weeks, Elon Musk and his team at the **Department of Government Efficiency (DOGE)** have taken actions that some argue resemble historical authoritarian power grabs. Reports indicate that Musk’s team has **gained access to Treasury payment systems** and has begun dismantling agencies like **USAID without congressional approval**. The ability of a private citizen to consolidate power in this way raises serious concerns about **democratic oversight, separation of powers, and national security risks**.

Historically, authoritarian figures have used legal mechanisms to **sidestep traditional checks and balances**, and critics argue that we’re seeing a similar pattern here. However, others believe that **government agencies have become bloated and inefficient**, and Musk’s involvement may be necessary to “streamline” operations.

How do you see this situation playing out? **Is Musk’s role a dangerous overreach, or is it a justified move toward government efficiency?** What safeguards should be in place to prevent **unelected individuals from gaining unchecked control over government operations?**

(For those interested in a deeper dive, I recently wrote an article on this topic: [\[Medium Link\]](https://medium.com/@TrendsToday/musk-trump-and-the-consolidation-of-government-a-historical-parallel-to-authoritarianism-437da316dc1f))"
"Trump has become increasingly threatening lately with claims of ""enemies within"" threatening to weaponize the DOJ and even using the national guard and military to get even and calling for special military tribunals. If he wins, is he likely to implement these plans or is he saying all this in jest?",PsychLegalMind,/r/PoliticalDiscussion/comments/1ga2ugs/trump_has_become_increasingly_threatening_lately/,"Trump has become increasingly threatening lately with claims of ""enemies within"" threatening to weaponize the DOJ and even using the national guard and military to get even and calling for special military tribunals. If he wins, is he likely to implement these plans or is he saying all this in jest?

Some of those who have worked closely with him in the past and others who have faced the wrath of Trump believe he is quite capable of following through with his threats. Others, like Johnson \[Speaker of the House\] have dismissed his comments as jest and comical or otherwise tried to rationalize it.

He has often threatened what he has described as democrats and leftists, but also named Nancy Pelosi and Adma Schiff specifically \[among others\].

On [Fox News](https://www.youtube.com/watch?v=Kmmx1zQCQds&amp;t=485s), Trump expressed support for using government force against domestic political rivals. Since 2022, when he began preparing for the presidential campaign, Trump has issued more than 100 threats to investigate, prosecute, imprison or otherwise punish his perceived opponents, NPR has found.

A review of Trump’s rally speeches, press conferences, interviews and social media posts shows that the former president has repeatedly indicated that he would use federal law enforcement as part of a campaign to exact “[retribution](https://truthsocial.com/@realDonaldTrump/109967829299924979).”

Vice President Kamala Harris “should be impeached and prosecuted,” Trump [said](https://www.youtube.com/watch?v=XgdVgxxELbQ&amp;t=1590s) at a rally last month.

“I will appoint a real special prosecutor to go after the most corrupt president in the history of the United States of America, Joe Biden, and the entire Biden crime family,” Trump [said](https://www.rev.com/transcript-editor/shared/bFORNS0mvNOxmr9cbwwpUJRzq-pofVnRhYN3vHJKQdeiFjefDAKwDpPowHng3r_kHNX-RDMkd2KrzETglXlCPsGi_Wk?loadFrom=PastedDeeplink&amp;ts=1706.4) last year.

Journalists who decline to identify the sources of leaked information would also face imprisonment, Trump said.

When right-wing radio host Glenn Beck asked Trump if he would lock up his opponents in a second term, Trump [responded](https://www.youtube.com/watch?v=lywHT5uH71M&amp;t=124s), “The answer is you have no choice because they’re doing it to us.”

Legal experts said that there are few guardrails preventing Trump from pursuing his plans to prosecute opponents and noted that Trump pressured the Department of Justice to investigate rivals during his first term. In about a dozen cases, the Justice Department followed through and initiated investigations, according to one [analysis](https://www.justsecurity.org/98703/chronology-trump-justice-department/).

If he wins, is he likely to implement these plans or is he saying all this in jest?

[Trump's 'enemy from within' threat spurs critics' alarm about his authoritarian shift - ABC News](https://abcnews.go.com/Politics/trumps-enemy-threat-spurs-critics-alarm-authoritarian-shift/story?id=114816374)

[Trump doubles down on calling Democrats 'enemies from within' at Georgia town hall](https://www.nbcnews.com/politics/2024-election/trump-democrats-enemies-within-rcna175628)

[https://www.nytimes.com/2024/10/15/us/politics/trump-opponents-enemy-within.html](https://www.nytimes.com/2024/10/15/us/politics/trump-opponents-enemy-within.html)"
Would you vote for AOC if she won the Democratic primary ?,[deleted],/r/PoliticalDiscussion/comments/1kitox5/would_you_vote_for_aoc_if_she_won_the_democratic/,In a hypothetical match between JD Vance and AOC would you vote for AOC ? Why or why not ? And what is your political alignment? I’ve been seeing alot of talk about her in the news as she recently gained alot of publicity and her approval rating has increased. A lot of people think she has the potential to win in 2028 and just seeing where everyones headspace is at. 
California to Negotiate Trade With Other Countries to Bypass Trump Tariffs,sweatycat,/r/politics/comments/1jrd48g/california_to_negotiate_trade_with_other/,
Sen. Bernie Sanders wins a fourth term representing Vermont,ATXJames,/r/politics/comments/1gklum0/sen_bernie_sanders_wins_a_fourth_term/,
People are threatening to boycott Disney after ABC suspends Jimmy Kimmel: ‘Let’s do to Disney what we did to Target’,ZombiePartyBoyLives,/r/politics/comments/1nke19k/people_are_threatening_to_boycott_disney_after/,
Lawsuit Challenging 2024 Election Results Moves Forward After Kamala Harris Received Zero Votes in a New York County,PostHeraldTimes,/r/politics/comments/1l8xciv/lawsuit_challenging_2024_election_results_moves/,
Trump’s birthday parade may be cancelled over thunderstorms,TimesandSundayTimes,/r/politics/comments/1l9qbdx/trumps_birthday_parade_may_be_cancelled_over/,
"Liberal candidate wins Wisconsin Supreme Court race in blow to Trump, Musk",TheJungLife,/r/politics/comments/1jpd4lu/liberal_candidate_wins_wisconsin_supreme_court/,
Donald Trump Named in Jeffrey Epstein Flight Logs Released by His Own Attorney General,MothersMiIk,/r/politics/comments/1izwz65/donald_trump_named_in_jeffrey_epstein_flight_logs/,
Biden calls for ban on congressional stock trading,APnews,/r/politics/comments/1hgegci/biden_calls_for_ban_on_congressional_stock_trading/,
Justice Department Told Trump in May That His Name Is Among Many in the Epstein Files,aresef,/r/politics/comments/1m7i9tq/justice_department_told_trump_in_may_that_his/,
"Obama Breaks Silence on Trump’s ‘Unimaginable’ Presidency - “Imagine if I had done any of this,” the former two-term president said.",Quirkie,/r/politics/comments/1jri2a8/obama_breaks_silence_on_trumps_unimaginable/,
Pritzker Calls for Trump's Removal from Office Under 25th Amendment,OkayButFoRealz,/r/politics/comments/1nvb3ts/pritzker_calls_for_trumps_removal_from_office/,
Donald Trump's Name in Jeffrey Epstein Files Redacted by FBI: Report,OkayButFoRealz,/r/politics/comments/1mez4lh/donald_trumps_name_in_jeffrey_epstein_files/,
The Trump Administration Accidentally Texted Me Its War Plans,IWantPizza555,/r/politics/comments/1jiuiu5/the_trump_administration_accidentally_texted_me/,
Tim Walz says he may run for president in 2028 — despite failure of Harris campaign: ‘Do whatever it takes’,Ripamon,/r/politics/comments/1j2oz52/tim_walz_says_he_may_run_for_president_in_2028/,
"Calls for Hegseth's Resignation Spread After War Plans Text Blunder: 'If This Doesn't Get You Fired, Nothing Does'",newsspotter,/r/politics/comments/1jj52k1/calls_for_hegseths_resignation_spread_after_war/,
Billionaires at Trump's Swearing-In Have Since Lost $210 Billion,bloomberg,/r/politics/comments/1j8841y/billionaires_at_trumps_swearingin_have_since_lost/,
House Democrat Calls to Impeach Trump for Defying Supreme Court,OkayButFoRealz,/r/politics/comments/1k1g2hu/house_democrat_calls_to_impeach_trump_for_defying/,
Elon Musk draws outrage over 'odd-looking salute' at Trump inauguration celebration,cjdarr921,/r/politics/comments/1i603sl/elon_musk_draws_outrage_over_oddlooking_salute_at/,
"Maine Gov. Janet Mills beats Donald Trump, gets school meal funds restored while defending trans kids. She said she would see him in court. She did. She won.",southpawFA,/r/politics/comments/1kfohcu/maine_gov_janet_mills_beats_donald_trump_gets/,
211 House Republicans Vote to Block Epstein Files,CrispyMiner,/r/politics/comments/1m0prt2/211_house_republicans_vote_to_block_epstein_files/,
Disney Plus Subscribers Quit in Droves Over Jimmy Kimmel Axe,CrotalusHorridus,/r/politics/comments/1nl8q3j/disney_plus_subscribers_quit_in_droves_over_jimmy/,
"President Trump Embarrassed Himself, the Nation, and Every Thinking Human on Earth. In the Oval Office on Friday, Donald Trump and JD Vance Behaved Like Angry Children. Volodymyr Zelenskyy Acted Like a Man.",OkayButFoRealz,/r/politics/comments/1j0nub8/president_trump_embarrassed_himself_the_nation/,
"Trump judge releases 1,889 pages of additional election interference evidence against the former president",HandSack135,/r/politics/comments/1g6kb8n/trump_judge_releases_1889_pages_of_additional/,
