title,author,permalink,body
Conservatives: What does 'Shoving it Down our Throats' mean?,TheNecroticPresident,/r/Askpolitics/comments/1hrc00e/conservatives_what_does_shoving_it_down_our/,"I see this term come up a lot when discussing social issues, particularly in LGBTQ contexts. Moderates historically claim they are fine with liberals until they do this.

So I'm here to inquire what, exactly, this terminology means. How, for example, is a gay man being overt creating this scenario, and what makes it materially different from a gay man who is so subtle as to not be known as gay? If the person has to show no indication of being gay, wouldn't that imply you aren't in fact ok with LGBTQ individuals?

How does someone convey concern for the environment without crossing this apparent line (implicitly in a way that actually helps the issue they are concerned with)?

Additionally, how would you say it's different when a religious organization demands representation in public spaces where everyone (including other faiths) can/have to see it?"
Why don’t we have a national voting ID and a Voting holiday?,Joeyjojojrshabado70,/r/Askpolitics/comments/1ghhuwz/why_dont_we_have_a_national_voting_id_and_a/,"It seems to me that if we had a federally issued voter ID card (like a social security card) that every citizen got free of charge and a voting holiday so everyone could get to the polls, we could alleviate all of this nonsense about non-citizens voting. 

I’ve seen some on the right adamantly against this. Can anyone tell me why this would be a bad idea that doesn’t involve the desire to suppress votes?"
"Americans who have not yet voted, are you going to vote tomorrow?",blorbot,/r/Askpolitics/comments/1gjdr0c/americans_who_have_not_yet_voted_are_you_going_to/,Why or why not?
"To the right, how are you feeling about Trumps recent support in an increase to the immigration cap on H1B visa?",tommywiseauYT,/r/Askpolitics/comments/1hokjy1/to_the_right_how_are_you_feeling_about_trumps/,"With Trumps recent support of the increase, especially from a campaign ran specifically on less immigrants, how does this affect the view of him? "
Honest Q for Trump supporters: Does it not give you pause that Trump has zero endorsements from former presidents?,DocMedz,/r/Askpolitics/comments/1g4nmr0/honest_q_for_trump_supporters_does_it_not_give/,"While Harris, not only has endorsements from every living ex-Pres, she’s also getting endorsements from former GOP officials. 

Added ref: https://www.reddit.com/r/TheAllinPodcasts/s/6Qjs3oZYBU"
What do conservatives think about all of Trump's pardons?,[deleted],/r/Askpolitics/comments/1h4vfjb/what_do_conservatives_think_about_all_of_trumps/,"Trump's pardons

* Charles Kushner (family): Jared Kushner’s father, convicted of tax evasion, witness retaliation, and making false statements

* Roger Stone: Longtime Trump associate, convicted of obstruction, witness tampering, and false statements

* Paul Manafort: Former Trump campaign chair, guilty of tax fraud, bank fraud, and conspiracy against the U.S.

* Michael Flynn: Former National Security Advisor, guilty of lying to the FBI about Russian contacts

* Stephen Bannon: Former White House adviser, charged with defrauding donors through the “We Build the Wall” campaign

* Elliott Broidy: Republican fundraiser, guilty of acting as an unregistered foreign agent

* Kenneth Kurson: Friend of Jared Kushner, charged with cyberstalking

* Chris Collins: Former congressman, convicted of securities fraud conspiracy

* Duncan Hunter: Former congressman, guilty of misusing campaign funds

* Rick Renzi: Ex-congressman, convicted of extortion, bribery, and money laundering

* Lil Wayne &amp; Kodak Black: Rappers convicted on weapons charges; both publicly supported Trump

* Albert J. Pirro, Jr.: Convicted of tax fraud; ex-husband of Trump ally Jeanine Pirro

* Blackwater Contractors: Pardoned despite convictions for killing unarmed Iraqi civilians

* Clint Lorance: Convicted of second-degree murder for ordering soldiers to fire on unarmed Afghan civilians, killing two

* Mathew Golsteyn: Accused of killing a suspected Taliban bomb-maker, pardoned before trial

* Michael Milken: Convicted of securities fraud and financial crimes as the “junk bond king”

* Bernard Kerik: Guilty of tax fraud and lying to White House officials during a background check

* Randall “Duke” Cunningham: Pleaded guilty to conspiracy and tax evasion for accepting over $2 million in bribes in a major congressional bribery scandal

* Robert Cannon Hayes: Lied to the FBI about a bribery scheme involving political donations

* Steve Stockman: Former GOP congressman; sentence commuted for misuse of charitable funds

* Rod Blagojevich: Ex-Illinois governor; sentence commuted for political corruption

* Dinesh D’Souza: Conservative author; pardoned for campaign finance violations

* Scooter Libby: Former Cheney aide; pardoned for perjury and obstruction

* Eddie Gallagher: Navy SEAL; pardoned of war crimes charges

* Conrad Black: Ex-newspaper publisher; pardoned for fraud and obstruction

* Sholam Weiss: 845-year sentence commuted for fraud and money laundering

* Joe Arpaio: Former Arizona sheriff; pardoned for criminal contempt​​​​​​​​​​​​​​​​"
If the Republicans have the trifecta what will they get done in the first 2 years?,kke1123,/r/Askpolitics/comments/1gl1c86/if_the_republicans_have_the_trifecta_what_will/,"If the Republicans take the house then they'll have full power to legislate at least until 2026 midterms.

What will they get done?

\- Tarriffs?

\- Tax cuts?

\- Mass deportations?

\- Slashing federal agencies?

Trump ran primarily on the economy (and his plan to enact tariffs) and mass deportations. Project 2025 is a laundry list of items that Republicans want to enact. What do you think will be a priority and realistically get passed?"
"How can the notion that Trump ""can't be bought"" be reconciled with his relationship with Elon Musk?",[deleted],/r/Askpolitics/comments/1hdbwze/how_can_the_notion_that_trump_cant_be_bought_be/,"A frequent argument I've heard in favor of Donald Trump as a president and presidential candidate is the notion that, unlike common politicians, he ""can't be bought"". This idea generally suggests that because he's so rich and successful, no special interests can influence him to change his policy using bribery or lobbying.

I still occasionally hear this argument, both for Trump and as a justification for his appointment of mainly ultra-wealthy cabinet members. But how can this claim still be rationalized, in light of Elon Musk's highly publicized patronage of Trump's 2024 campaign? Musk, the world's richest man, poured hundreds of millions into Trump's campaign, and was rewarded for it with an seat in Trump's government where he can influence policy relevant to his own interests, and material changes to Trump's policies.

Trump himself flat-out said that he had ""no choice"" but to change his stance on electronic vehicles because of Musk's support. This seems like exactly the type of ""being bought"" that Trump's supporters still tend to claim he's immune to. Is there any distinction to be made here, or is this just pure hypocrisy/cognitive dissonance?"
"Conservative here: Without referencing Trump, why should I vote for Kamala ",Boring-Self-8611,/r/Askpolitics/comments/1g7am7g/conservative_here_without_referencing_trump_why/,"And please for the love of all that is good please cite as non biased source as possible. I just want genuine good faith arguments beyond Trump is bad

Edit: i am going to add this to further clarify what I desire here since there are a few that are missing what I am trying to ask. Im not saying not to ever bring up Trump, I just want the discussion to be based on policy and achievements rather than how dickish the previous president was. (Trust me I am aware how he comes off and I don’t like that either.) I want civil debate again versus he said she said and character bashing. 

Edit 2: lots upon lots of comments on here and I definitely can’t get to all of them but thank you everyone who gave concise reasoning and information without resorting to derogatory language of the other side. While we may not agree on everything (and many of you made very good points) You are the people that give me hope that one day we can get back to politics being civil and respectful. "
Why do you vote Republican?,Unicron1982,/r/Askpolitics/comments/1gy3p7k/why_do_you_vote_republican/,"I am not Americans i am swiss. And like most of the world i was totally........ confused when Donald Trump got reelected.

Can someone please tell me why this happened? 

If possible without the made up arguments like Inflation and stuff, we all know a president has no influence on that."
Why are conservatives against supporting Ukraine against Russian aggression?,[deleted],/r/Askpolitics/comments/1h2ly5t/why_are_conservatives_against_supporting_ukraine/,"Nearly all of my life the US has been fighting wars that were started by Republicans.  Just wondering why is this the line in the sand?

I've heard that Trump is anti-war, which is great and all.  But if he was serious, he would have exited Afghanistan while he was still in office and not pass the buck to the next president."
Do billionaires and corporations realize if they impoverish the country no one will afford their services?,[deleted],/r/Askpolitics/comments/1hpxkks/do_billionaires_and_corporations_realize_if_they/,"With all of the tax cuts for the rich, tariffs, price hikes, cuts to Social Security, mass deportations billionaires have planned for the country through the Trump administration, do they know that impoverishing the country and crashing the economy means no one will be able to afford their products and services? 

If Billionaires bankrupt the consumer classes, how will the generate money? How will the government generate money with no tax revenue? A broke consumer class cannot carry the economy. 

Do billionaires realize this? Does congress realize this? "
A shockingly contentious public demonstration occurred in the White House Oval Office with Trump and Vance together telling Zelensky to sign the mineral deal and that was the only way to have U.S. support. Zelensky left shortly after. Did Zelensky do the right thing by walking out without any deal?,PsychLegalMind,/r/PoliticalDiscussion/comments/1j0g3ur/a_shockingly_contentious_public_demonstration/,"Castigating Zelensky for not demonstrating enough gratitude for American support, Trump and his Vice President JD Vance raised their voices, accusing the besieged leader of standing in the way of a peace agreement.

“You’re not really in a good position right now.” Trump said. “You’re gambling with World War III.” At one moment, Vance accused Zelensky of being “disrespectful” toward his American hosts. “You’re not acting all that thankful,” Trump added. “Have you said ‘thank you’ once?” Vance asked Zelensky.

“You’re either going to make a deal or we’re out,” the US president said, adding later: “If we’re out, you’ll fight it out. I don’t think it will be pretty.”

Zelensky has often said thanks including earlier during the conference. Zelensky also expressed some reservations and need for further discussions before any deal could be signed referring to security guarantees.  However, shortly after the conference it was reported Zelensky had left without any deal. 

Trump noted Zelensky was not ready for peace, but that he could come back when he was. 

Did Zelensky do the right thing by walking out without any deal?

[https://time.com/7262883/trump-zelensky-meeting/](https://time.com/7262883/trump-zelensky-meeting/)"
Why did Kamala Harris lose the election?,[deleted],/r/PoliticalDiscussion/comments/1gksts4/why_did_kamala_harris_lose_the_election/,"Pennsylvania has just been called. This was the lynchpin state that hopes of a Harris win was resting on. Trump just won it. The election is effectively over. 

So what happened? Just a day ago, Harris was projected to win Iowa by +4. The campaign was so hopeful that they were thinking about picking off Rick Scott in Florida and Ted Cruz in Texas. 

What went so horribly wrong that the polls were so off and so misleading? 

"
"MEGATHREAD: Charlie Kirk dies after being shot at campus event in Utah, says President Trump",IrishChristmasLatte,/r/PoliticalDiscussion/comments/1ndpyoc/megathread_charlie_kirk_dies_after_being_shot_at/,https://www.bbc.com/news/live/c206zm81z4gt
How is Trump Getting Away with Everything?,SpiritFlimsy7446,/r/PoliticalDiscussion/comments/1jekmok/how_is_trump_getting_away_with_everything/," I’ve been following the Trump situation for years now, and I can't wrap my head around how he's managed to avoid any real consequences despite the sheer number of allegations, investigations, and legal cases against him. From the hush money scandal to the classified documents case, to the January 6th insurrection — it feels like any other politician would have been crushed under the weight of even *one* of these.

I get that Trump's influence over the Republican Party and the conservative media machine gives him a protective shield, but how deep does this go? Are we talking about systemic issues with the legal system, political corruption, or just strategic maneuvering by Trump and his team?

For context:  
📌 Trump was impeached *twice* — first for pressuring Ukraine to investigate Biden, and then for inciting the Capitol riot — yet he was acquitted both times because Senate Republicans closed ranks.  
📌 The classified documents case (where Trump allegedly kept top-secret files at Mar-a-Lago) seemed like an open-and-shut case, yet it's been bogged down in procedural delays and legal loopholes.  
📌 The New York hush money case involved falsifying business records to cover up payments to Stormy Daniels — something that would likely land an average citizen in jail — but Trump seems untouchable.  
📌 The Georgia election interference case (pressuring officials to ""find"" votes) looks like outright criminal behavior, yet Trump is still able to campaign without serious repercussions.

📌 Trump's administration recently invoked the Alien Enemies Act to deport Venezuelan migrants to El Salvador, directly defying a judicial order halting such actions. The administration argued that verbal court orders aren't binding once deportation planes leave U.S. airspace, a stance that has left judges incredulous. 

📌Trump's recent actions have intensified conflicts with the judiciary, showcasing attempts to wield unchallenged presidential authority. For instance, he proceeded with deportations despite court blocks, reflecting a strategy of making bold decisions and addressing legal challenges afterward.

📌 In a landmark decision, the Supreme Court ruled that presidents have absolute immunity for acts committed within their core constitutional duties, and at least presumptive immunity for official acts within the outer perimeter of their responsibilities. This ruling has significant implications for holding presidents accountable for their actions while in office

It seems like Trump benefits from a mix of legal stall tactics, political protection, and public perception manipulation. But is the American legal system really that broken, or is there some higher-level political game being played here?

If you want to read more about these cases, here are some good resources:

* [Classified Documents Case – DOJ Filing](https://www.justice.gov/)
* [Georgia Election Case – Background](https://www.nytimes.com/)
* [Stormy Daniels Hush Money – NYT Report](https://www.nytimes.com/)
* [January 6th Capitol Riot – House Committee Findings](https://www.jan6th.house.gov/)
* [https://www.theguardian.com/us-news/live/2025/mar/17/donald-trump-kennedy-center-jd-vance-tariffs-ukraine-immigration-us-politics-live-news?utm\_source](https://www.theguardian.com/us-news/live/2025/mar/17/donald-trump-kennedy-center-jd-vance-tariffs-ukraine-immigration-us-politics-live-news?utm_source)
* [https://www.politico.com/news/2025/03/17/trump-presidential-power-courts-test-00234173?utm\_source](https://www.politico.com/news/2025/03/17/trump-presidential-power-courts-test-00234173?utm_source)
* [https://en.wikipedia.org/wiki/Trump\_v.\_United\_States\_%282024%29?utm\_source](https://en.wikipedia.org/wiki/Trump_v._United_States_%282024%29?utm_source)"
"Do You Think the US is Moving in a ""Fascist"" Direction?",hern0gjensen,/r/PoliticalDiscussion/comments/1iethdw/do_you_think_the_us_is_moving_in_a_fascist/,"Much has been said about President Trump's tendencies toward authoritarianism, his desire to be a ""dictator,"" etc. Comparisons between him and Hitler are not uncommon. For example, former Secretary of Labor accused Trump of being a ""neofascist"" in [The Guardian](https://www.theguardian.com/commentisfree/2025/jan/24/trump-fascism-what-to-do).

And so, I'm curious how members of the subreddit feel about the possible future of the United States. You can credibly argue that the State Department's move to reportedly n[o longer issue passports to transgender Americans](https://19thnews.org/2025/01/transgender-passports-state-department/), or the recent bill out of Tennessee which would c[riminalize lawmakers voting against Trump's immigration agenda](https://www.newsweek.com/tennessee-bill-would-prohibit-voting-against-trump-immigration-policies-2023749), are authoritarian in nature. Another example could be what is happening to [those who investigated Trump's alleged crimes.](https://thehill.com/homenews/administration/5119963-trump-administration-forces-out-fbi-officials/)

I could give more examples, but I think I've summarized the situation well enough.

And so, do you think the United States is at risk of an authoritarian takeover? How do you feel about the doom-posting many on Reddit are doing, saying another Holocaust is imminent.

One point to start from: a recent political science paper has found that democratic backsliding is frequently followed by a ""U-turn"" towards more democratic governance. [Read here](https://www.tandfonline.com/doi/full/10.1080/13510347.2024.2448742#abstract). Could that be the United States' future?"
President Trump abruptly cut short his meeting at G7 and is on his way back. White House added due to circumstances in the Middle East and Trump will be in the Security Room meeting the Chiefs. Our Tankers and air craft carrier is also on its way. Are we about to enter into a direct war with Iran?,PsychLegalMind,/r/PoliticalDiscussion/comments/1ld9zuf/president_trump_abruptly_cut_short_his_meeting_at/,"Trump additionally noted via tweet for all Iranians to leave Tehran \[Capital of Iran\], warning that he had earlier stated for Iran to make a deal. 

Press secretary Karoline Leavitt, in a [post on X](https://x.com/presssec/status/1934755141082861736?s=46&amp;t=M9mt1Xfq58yAZ64nK8b2qw), said that “much was accomplished” during Trump’s meetings on Monday with other leaders at the summit in Canada. But, she continued, “because of what’s going on in the Middle East, President Trump will be leaving tonight after dinner with Heads of State.”

The change of plans only added to the sense of uncertainty around Israel’s ongoing military operation in Iran, which Trump seemed to warn was about to intensify in an ominous and somewhat cryptic social media post after a day of meeting with world leaders.

Are we about to enter into a direct war with Iran?

[https://www.nytimes.com/live/2025/06/16/us/trump-news](https://www.nytimes.com/live/2025/06/16/us/trump-news)"
Republican Senate leader Mitch McConnell acknowledges that Trump killed the biggest border security bill in decades so he could campaign on the issue instead. What will this mean for the election?,Spiderwig144,/r/PoliticalDiscussion/comments/1gi79lt/republican_senate_leader_mitch_mcconnell/,"Link to his words on it:

* https://x.com/harris_wins/status/1848005868320702568

And here's a link to the bill being killed earlier this year:

* https://www.nbcnews.com/politics/congress/senate-republicans-block-border-security-bill-campaign-border-chaos-rcna153607

McConnell had given the green light for James Lankford, a conservative Republican, to negotiate a comprehensive border security package with Democrats led by Kyrsten Sinema, a moderate border state Senator from Arizona. The final package was agreed to by all parties and signed off on by McConnell as well as Democratic leaders before Trump publicly came out against it and urged his allies in the House and Senate GOP to kill it. The reason, according to widespread reporting including the above, was that he wanted to run his campaign on there being chaos at the border and him being the solution to fix it, and he worried that the proposed bill would resolve the problem and deprive him of something to run on. 

Since then, Trump has made immigration and the idea of a border crises the central point of his campaign. He's gone to every border state to rant about it and lambast Democrats for not fixing it. He's brought it up in every appearance, at every interview, at the presidential debate. He's tied the border to false stories about migrants coming over to eat people's pets. He brings it up at every rally. Yet it was he himself who worked to ensure that it wasn't fixed, and now his own party's Senate leader acknowledges it. 

What sort of impact do you think this will have on the election? Will it move voters? Will people see the truth behind the dynamic? Or will his strategy work?"
"The ICE has sent out a directive halting deportations in the farming, restaurant, and hotel sectors. What is our immigration policy now?",The_Awful-Truth,/r/PoliticalDiscussion/comments/1lb2zc9/the_ice_has_sent_out_a_directive_halting/,"From the New York Times:

&gt;The guidance was sent on Thursday in an email by a senior ICE official, Tatum King, to regional leaders of the ICE department that generally carries out criminal investigations, including work site operations, known as Homeland Security Investigations.

&gt;“Effective today, please hold on all work site enforcement investigations/operations on agriculture (including aquaculture and meat packing plants), restaurants and operating hotels,” he wrote in the message.

Is this a pause in immigration enforcement, or a lasting change? Or some kind of middle ground?

ETA: thank you very much for all the responses! Haven't yet read them all, but I appreciate the civil and respectful tone of most of them, both from people who agree and disagree with my own opinions.

ETA 2: This article in the New York Times has some good background on how this apparently happened. It sounds like Trump hasn't really changed his policy, but was forced to call a pause by the specter of crops rotting in the fields:  [https://www.nytimes.com/2025/06/14/us/politics/trump-immigration-raids-workers.html](https://www.nytimes.com/2025/06/14/us/politics/trump-immigration-raids-workers.html) . 

ETA 3: As pointed out by several commenters, Trump has since reversed himself again, we're apparently back to raiding crop harvests. "
Should we be seriously concerned that Trump is mentally unwell?,damndirtyape,/r/PoliticalDiscussion/comments/1jnuxws/should_we_be_seriously_concerned_that_trump_is/,"I know this title is going to sound like a partisan attack to some. But, I'm wondering if we should be seriously considering the possibility that the US president is an older man who has experienced notable cognitive decline and is behaving erratically. 

When Trump is discussed, you will occasionally here people using the term ""sanewashing"". This means acting like Trump's ideas are saner than they really are. His supporters want to believe he's playing 4-D chess. His opponents want to believe he has sinister intentions. But, could it be that his behavior legitimately does not make sense because he is unwell? 

The man is currently threatening Canada, Greenland, and Panama. On the campaign trail, there was no mention of the idea that he might try to forcibly expand US territory. No one voted for that. I don't think his own party is on board with these ideas. These ideas seem legitimately crazy. 

Not that long ago, he was calling Zelensky a dictator because there haven't been elections. Later, when questioned, he said ""Did I say that?"". Now, he is apparently angry at Putin for questioning Zelensky's legitimacy. Is he seriously confused? 

Some people want to believe that Trump is attempting to implement madman theory. This was a political strategy popularized by Nixon who wanted US adversaries to believe that he was capable of anything. But...could it be that Trump is legitimately losing his mind? 

There's an argument that the world has a problem with aging leaders. Famously, people began having doubts about Biden's cognitive ability. There also might be reason to question Putin's mental state. When asked to explain the war, he begins talking about medieval history. And now, the US is led by a man in his 70's whose behavior might be described as erratic. 

I don't want to be agist, but it’s an established medical fact that older people experience brain shrinkage and cognitive decline. In the US, we've seen examples of older politicians (like Diane Feinstein) who noticeably decline while in office. There's a problem with people continuing to elect well known incumbents, not realizing that they are losing it as they get older. 

Should we be seriously worried that the current US president is cognitively declining? And can the US system handle that? The US presidency is a very powerful office. Does the government self-destruct if the president loses their mind?"
