title,author,permalink,body
"Lindsey Graham, Mike Johnson and Marco Rubio all stood in solidarity with the Ukraine in the past.  They all have done a 180 degree about face on their previous stances.  Whey are all notable republicans falling in line with this turn towards Russia?",jpcapone,/r/PoliticalDiscussion/comments/1j2snsg/lindsey_graham_mike_johnson_and_marco_rubio_all/,Pete Hegseth has stopped cyber operations against Russia. Donald Trump has spurned Ukraine in their hour of need against the Russian army. Even Putin has stated that America's foreign policy is in line with Russia's.  Why isn't there more outrage from elected republican officials against these practices?  
As Elon Musk appears to make a Nazi salute at an inauguration day event what should the incoming Trump administration do to address the incident?,The_Egalitarian,/r/PoliticalDiscussion/comments/1i67g0p/as_elon_musk_appears_to_make_a_nazi_salute_at_an/,"https://www.theguardian.com/technology/2025/jan/20/trump-elon-musk-salute

Musk himself has been associating with far-right figures over the past few years and has had prior incidents involving anti-semitism and white-nationalism: 

[Elon Musk claims George Soros ‘hates humanity.’ The ADL says Musk’s attacks ‘will embolden extremists’](https://www.theguardian.com/technology/2025/jan/20/trump-elon-musk-salute)

[IBM pulls X ads as Elon Musk endorses white pride](https://www.theverge.com/2023/11/16/23964160/elon-musk-antisemitic-x-post-ibm-ads)

[White House criticises Elon Musk over 'hideous' antisemitic lie](https://www.bbc.com/news/world-us-canada-67446800)

Should the Trump administration separate itself from Musk going forward?

Will this incident cause any actual pushback against Musk being given a role in government?"
"Jack Smith's concludes sufficient evidence to convict Trump of crimes at a trial for an ""unprecedented criminal effort"" to hold on to power after losing the 2020 election. He blames Supreme Court's expansive immunity and 2024 election for his failure to prosecute. Is this a reasonable assessment?  ",PsychLegalMind,/r/PoliticalDiscussion/comments/1i16u8t/jack_smiths_concludes_sufficient_evidence_to/,"The document is expected to be the final Justice Department chronicle of a dark chapter in American history that threatened to disrupt the peaceful transfer of power, a bedrock of democracy for centuries, and complements already released indictments and reports.

Trump for his part responded early Tuesday with a post on his Truth Social platform, claiming he was “totally innocent” and calling Smith “a lamebrain prosecutor who was unable to get his case tried before the Election.” He added, “THE VOTERS HAVE SPOKEN!!!”

Trump had been indicted in August 2023 on charges of working to overturn the election, but the case was delayed by appeals and [ultimately significantly narrowed by a conservative-majority Supreme Court](https://www.ap.org/news-highlights/elections/2024/supreme-court-rules-ex-presidents-have-broad-immunity-dimming-chance-of-a-pre-election-trump-trial/) that held for the first time that former presidents enjoy sweeping immunity from criminal prosecution for official acts. That decision, Smith’s report states, left open unresolved legal issues that would likely have required another trip to the Supreme Court in order for the case to have moved forward.

Though Smith sought to salvage the indictment, the team dismissed it in November because of longstanding Justice Department policy that says sitting presidents cannot face federal prosecution.

Is this a reasonable assessment?

[https://www.justice.gov/storage/Report-of-Special-Counsel-Smith-Volume-1-January-2025.pdf](https://www.justice.gov/storage/Report-of-Special-Counsel-Smith-Volume-1-January-2025.pdf)

[https://www.politico.com/news/2025/01/14/jack-smith-trump-report-00198025](https://www.politico.com/news/2025/01/14/jack-smith-trump-report-00198025)

Should state Jack Smith's **Report**. "
"Trump has said the DOJ will be filing a lawsuit against California's redistricting effort. With a Republican majority on the Supreme Court, can this lawsuit actually prevent California from doing what Texas is doing, giving the Republicans a House advantage?",Orangekale,/r/PoliticalDiscussion/comments/1mzv1a2/trump_has_said_the_doj_will_be_filing_a_lawsuit/,"On Monday President Trump said that the federal government plans to get involved to try to stop California's redistricting effort.

[&gt;""I think I'm going to be filing a lawsuit pretty soon and I think we're going to be very successful in it,"" Trump said. ""We're going to be filing it through the Department of Justice. That's going to happen.""](https://abcnews.go.com/Politics/live-updates/trump-admin-live-updates/?id=124929306&amp;entryId=124956103)

&gt;Last week, California's state legislature passed bills that comprise the state's plan to put new congressional bills on the ballot in a November special election, in retaliation for a congressional redistricting plan moving forward in Texas. California Gov. Gavin Newsom, a Democrat, said the state was ""standing up"" to Trump and the GOP.

With a Republican majority on the Supreme Court, if the Trump lawsuit against California reaches the Supreme Court, will they accept it and block California? If so, what ramifications would there be if California was not able to redistrict the way Texas has been able to? Could this also trickle down to other US states run by democrats who would want to counteract Texas, if Trump continues to file lawsuits against blue states while red states can continue to redistrict in ways advantageous to house republicans?"
Is the American population beginning to turn on Trump?,eh_steve_420,/r/PoliticalDiscussion/comments/1npqsfb/is_the_american_population_beginning_to_turn_on/,"Several prominent Anti-Trump voices have 
recently publicly stated that they think that the nation has hit a turning point because of the recent events in the past week.  

Robert Reich expressed his views in a  substack article entitled ""The Sleeping Giant Is Awakening"" (It won't let me link a sub stack article, you'll have to Google it).  Reich argues that Trump’s blatant authoritarian behavior over the course of a week — suing the New York Times, attacking reporters, cheering censorship, threatening to pull network licenses, and demanding prosecutions of rivals — has finally gone too far for many Americans. The backlash, seen most clearly in the massive Disney boycott and Trump’s falling poll numbers, shows the public is no longer just grumbling but actively resisting. Reich believes this marks the “sleeping giant” of American democracy awakening, as it has in past crises like McCarthyism, civil rights, Vietnam, and Watergate.

Historian Heather Cox Richardson agreed with Reich in her semi-weekly [Politics Chat live stream](https://youtu.be/AQ2ZxeneQrk), citing similar examples while also emphasizing that his poll numbers are trending downward — including approval on his performance with the economy, immigration, among other areas.  She also cites how several notable right-wing figures used their platform to speak out against Trump's infringements on the First Amsnsmen— noting that the struggle is becoming the American people vs. an increasingly authoritarian government, rather than left vs. right. 

Do you agree with these perspectives?   Do they align with what you experience in your  day-to-day lives?  What are your overall thoughts?"
President Trump has proposed sending US citizens to El Salvador's notorious maximum security prison. Would the Supreme Court likely allow this?,damndirtyape,/r/PoliticalDiscussion/comments/1jzf345/president_trump_has_proposed_sending_us_citizens/,"In recent months, the Trump administration has begun a controversial deportation policy that involves sending immigrants to El Salvador’s Terrorism Confinement Center (CECOT). This facility is a maximum-security prison that holds tens of thousands of suspected gang members. 

CECOT has drawn criticism from international human rights organizations. Prisoners are often held without formal charges. They are denied access to legal counsel, and they have almost no contact with the outside world. They are confined in overcrowded cells and movement is heavily restricted. They also must remain silent almost constantly. The facility lacks proper ventilation and temperatures inside can reportedly exceed 90 degrees. Medical care is limited, and deaths in custody have been reported. Observers describe the conditions as severe and dehumanizing. 

The Trump administration has defended its policy by citing the Alien Enemies Act of 1798, a wartime statute that allows the detention or removal of foreign nationals. In one high-profile case, a Maryland resident named Kilmar Abrego García was mistakenly sent to CECOT, despite legal protections that had been granted to him. The Supreme Court later ordered the administration to “facilitate” his return. But, officials have argued that this only requires them to permit his reentry if he is released. President Bukele has declined to release him, and the administration has not pursued further action. 

More recently, President Trump has proposed extending this approach to U.S. citizens. In a meeting with President Bukele, he stated, “Home-growns are next. You gotta build about five more places.” He later added, “These are bad people. These are killers, gang members, and we are absolutely looking at sending them there.” ""You think there’s a special category of person? They’re as bad as anybody that comes in. We have bad ones too. I’m all for it.” 

In recent history, the Supreme Court has often shown a willingness to uphold the actions of President Trump. In light of that record, would it likely authorize the transfer of U.S. citizens to this El Salvador prison? Are there sufficient legal protections in place to prevent this, and is there a real danger that President Trump could begin sending US citizens to this prison?"
"The Republican ""Big Beautiful Bill"" has passed. What will be the consequences?",Objective_Aside1858,/r/PoliticalDiscussion/comments/1lqz0jq/the_republican_big_beautiful_bill_has_passed_what/,"The Democrats will be expected to run against benefit cuts in the bill. Will they be successful?

What other pieces of the bill will end up being an unpleasant surprise to people?

Does anyone care about debt any longer?"
"On Monday night Bernie Sanders released a video aimed at disaffected left-wingers who see the war in Gaza as a top issue, will his words sway them?",The_Egalitarian,/r/PoliticalDiscussion/comments/1gfepbg/on_monday_night_bernie_sanders_released_a_video/,"Senator Bernie Sanders put out a video on Monday that is aimed at left-wing voters that feel they can't vote for Kamala due to the conflict in Gaza.

[YouTube - Bernie Sanders: “I disagree with Kamala’s position on the war in Gaza. How can I vote for her?” Here is my answer:](https://www.youtube.com/watch?v=Vf5MThSniiY) (Transcript in comments)

He makes the case that even though Harris and Biden's position isn't ideal, they are far better than Trump on the Gaza. 
He says Netanyahu would much prefer Trump in office, ""who is extremely close to Netanyahu and sees him as a like-minded, right wing extremist ally.""

He also makes the case that there are other issues at stake in this election, such as women's bodily autonomy, climate change, and wealth inequality.

If Senator Sanders correct in his views?

Will this video change any minds among those who view the Biden-Harris administration in too negative a light to vote for Kamala Harris?"
"With the death of Jimmy Carter, Trump has become the oldest living former president, and by the end of his term he will become the oldest president ever. Why is America struggling to hand politics to a new generation?",defransdim,/r/PoliticalDiscussion/comments/1hpb5d0/with_the_death_of_jimmy_carter_trump_has_become/,"We had many people in the media voicing frustration with Biden's age, but when Biden dropped out, America elected another old white guy who was almost Biden's age anyway. The much more youthful, experienced woman was rejected. What does America actually want?"
Trump yesterday called on military leaders to “handle” the “enemy from within” and to use US cities as “training grounds.” Is this an explicit call for fascism?,Giants4Truth,/r/PoliticalDiscussion/comments/1nup2ph/trump_yesterday_called_on_military_leaders_to/,"Note: In his prior speeches he defined the “enemy from within” as the Democratic party, progressive non-profits, people who support racial justice, and anyone who protests the actions of ICE or law enforcement.   Do you think this is dangerous?"
How'd we go from deporting illegal immigrants to deporting legal ones?,FenisDembo82,/r/PoliticalDiscussion/comments/1l096x3/howd_we_go_from_deporting_illegal_immigrants_to/,"All along, Trump supporters have been saying they only want the people who came illegally to be deported.  Even if they have committed no other crimes they say that being here illegally is deserving of deportation. But now,  the Trump regime wants to deport up to half a million people who came here legally.  Do Trump supporters here agree with that? Do you support that?

https://www.nytimes.com/2025/05/31/us/politics/supreme-court-immigrants.html?unlocked_article_code=1.LU8.a7-X.XvNLyX1oktyL&amp;smid=nytcore-android-share"
"Bolsonaro sentenced to 27 years in Brazil. Both Trump and Rubio have promised a response calling it a witch-hunt trial. Is Bolsonaro's Political career over; If not, what does his future political career hold and should U.S. just stay out of Brazil's internal matter?",PsychLegalMind,/r/PoliticalDiscussion/comments/1neslyh/bolsonaro_sentenced_to_27_years_in_brazil_both/,"Four of the five justices voted to convict Bolsonaro and seven co-conspirators, including his running mate, defense minister and Navy commander finding they sought to overthrow the state. 

Previously, The White House had sought to force Brazil to drop the case with steep tariffs, a trade investigation and severe sanctions against the Supreme Court justice leading it. Instead, several Brazilian justices criticized the U.S. attempts to intervene as they voted to convict.

Asked about Mr. Bolsonaro’s conviction, Mr. Trump told reporters in Washington on Thursday that he was “very unhappy about it. I know President Bolsonaro” and like him, he said. “I think it’s a terrible thing, very terrible. I actually think it’s very bad for Brazil.”

Is Bolsonaro's Political career over; If not, what does his future political career hold and should U.S. just stay out of Brazil's internal matter? 

[Brazil's Bolsonaro sentenced to 27 years after landmark coup plot conviction | Reuters](https://www.reuters.com/world/americas/brazils-bolsonaro-sentenced-27-years-after-landmark-coup-plot-conviction-2025-09-11/)

[U.S. warns of response to 'witch hunt' after Brazil’s Bolsonaro sentenced to 27 years](https://www.cnbc.com/2025/09/12/us-warns-of-response-to-witch-hunt-after-brazils-bolsonaro-sentenced-to-27-years.html)"
Why do Trump and Musk keep pushing the Social Security fraud narrative?,KensofarEon,/r/PoliticalDiscussion/comments/1j4h36s/why_do_trump_and_musk_keep_pushing_the_social/,"&gt;[150-year-olds are not receiving Social Security payments ](https://www.marketplace.org/2025/02/20/150-year-olds-are-not-receiving-social-security-payments/)

&gt;This week, he tweeted a spreadsheet showing how many people in the system are in each age bracket. [More than 1.3 million ](https://x.com/elonmusk/status/1891350795452654076)people are marked as between the ages of 150 and 159, while almost 2,800 are listed as 200 and older. 

&gt;“If you take all of those millions of people off Social Security, all of a sudden we have a very powerful Social Security with people that are 80 and 70 and 90, but not 200 years old,” Trump said. 

&gt;But data on the Social Security Administration’s website shows [that only about 89,000 people over the age of 99 ](https://www.ssa.gov/oact/progdata/benefits/primaries.html)are receiving payments on the basis of their earnings. And there are [only an estimated 108,000 centenarians](https://www.pewresearch.org/short-reads/2024/01/09/us-centenarian-population-is-projected-to-quadruple-over-the-next-30-years/) living in the U.S., according to United Nations data, while the oldest known human being lived [to the age of 122](https://www.cnbc.com/2023/02/21/longevity-expert-3-reasons-the-worlds-oldest-person-lived-to-122.html). 

&gt;Wired magazine reported that the number of people in the 150-year age bracket [may have to do with the programming language](https://www.wired.com/story/elon-musk-doge-social-security-150-year-old-benefits/) used by the SSA, known as COBOL, or the Common Business Oriented Language. The 65-year-old system [can still be found at government agencies, businesses and financial institutions. ](https://www.marketplace.org/shows/marketplace-tech/the-65-year-old-computer-system-at-the-heart-of-american-business/)

&gt;Basically, when there is a missing or incomplete birthdate, COBOL defaults to a reference point. The most common is May 20, 1875, when countries around the world [attended a convention on metric standards](https://usma.org/laws-and-bills/metric-convention-of-1875). Someone born in 1875 would be 150 in 2025, which is why entries with missing and incomplete birthdates will default to that age, Wired explained. 

What's the strategy here? Are they claiming fraud to justify program wide cuts to Social Security? Or will they claim they reduced Social Security fraud to highlight the effectiveness of DOGE?

Edit:

Thank you kindly for the discussion, I appreciate everyone's viewpoints and answers to my questions.

My personal beliefs are the status quo is taking us down the wrong path, we need to change to a more empathetic and environmentally conscious future. We need to do this nonviolently and inclusively, and the more we are active about sharing the facts the better off we will be. We need people to understand that billionaires are only there because the workers are sacrificing a majority of their labor value to keep a job and collect Social Security. If you take SS away, just like taking away pensions or losing a major investment into a stock market dive—there will be public outrage. We must rise above the violence and  always remain civil whenever possible. The pardoning of the J6 folks was a slippery slope to the protection of democracy, essentially condoning their actions because their leader is now in power... that is a threat to democracy if I have ever seen one.  That said, never be afraid to rise up from those who seek to tread on you...

I highly recommend the film Civil War from 2024.  Not only is it a cinematographic masterpiece but also serves as a borderline absurdist take on the USA if say, a third Trump term was introduced...."
"Donald Trump's former Chief of Staff has stated that Trump ""fits the definition of Fascist"". Harris has stated that she agrees with that assessment. Is this an effective line of attack?",Objective_Aside1858,/r/PoliticalDiscussion/comments/1gb3oj9/donald_trumps_former_chief_of_staff_has_stated/,"Note: My question is not ""is Trump a fascist"" or ""what is a fascist"" or ""how is Trump similar or different to historical authoritarians""

  
My question is: Is calling Trump a fascist effective, in the sense of influencing the votes people cast between now and Election Day?

  
Obviously many voters will not be swayed by this. Are there those that will? And will it turn them away from Trump, or make them reject the accusation and hence change their voting behavior that way?"
What do you think about Gavin Newsom's new social media campaign mocking Trump's posting style?,AmigoDelDiabla,/r/PoliticalDiscussion/comments/1n3h9ca/what_do_you_think_about_gavin_newsoms_new_social/,"It's very evident Newsom wants to be on the national stage, and in the last few days, he's done just that by his repeated social media posts that mimic Trump's.  

Is this humor/mockery approach the right way to pop the balloon that has been Trump's supporters for so long?  Or is this racing toward the bottom of the barrel in regard to political discourse?  "
Is the Epstein scandal the biggest blunder & own goal by the conservative MAGA movement?,LeonidasKing,/r/PoliticalDiscussion/comments/1m7mjy5/is_the_epstein_scandal_the_biggest_blunder_own/,"There are often accusations that Democrats &amp; the media gin up fake scandals to oppose Trump &amp; hobble his presidency.

The Epstein scandal is 100% a scandal of republicans own making. This issue was lying dormant for the longest time, the media &amp; Democrats didn't have much interest in it, but his own supporters and voters fanned the flames, kicked the hornet's test and created a tempest that has now ensnared Trump's presidency, after what was a fairly surprising stretch of good press.

Is this a devastating own goal &amp; catastrophic blunder by the right wing? Have they inadvertently sunk the guy they waited to hoist up?

"
Trump reiterated today his goal for the Canada tariffs—annexation. What is the likely outcome of this?,invariantspeed,/r/PoliticalDiscussion/comments/1ig9hul/trump_reiterated_today_his_goal_for_the_canada/,"He posted this on “truth social” today:

&gt; We pay hundreds of Billions of Dollars to SUBSIDIZE Canada. Why? There is no reason. We don’t need anything they have. We have unlimited Energy, should make our own Cars, and have more Lumber than we can ever use. Without this massive subsidy, Canada ceases to exist as a viable Country. Harsh but true! Therefore, Canada should become our Cherished 51st State. Much lower taxes, and far better military protection for the people of Canada — AND NO TARIFFS!

*(I am not linking because I know many subs are censoring links to “truth social” and twitter. It will be the first result if you google it.)*

In summary, he asserts:
1. That the US doesn’t need Canada
2. That Canada is on US-supplied life support
3. That shutting down trade with Canada will kill the country and allow it to be annexed

I assume this is why he is currently refusing phone calls from the Canadian government. He doesn’t have demands for Canada. The demand *is* Canada. But *the question* is where this goes politically.

**UPDATE**

The post I quoted has been removed from his Truth Social and Twitter account as of today (February 3rd). Now there is no posts about Canada dated from yesterday (February 2nd). Instead there is a post today hand-wavingly complaining about Canada not allowing US banks and not cooperating in the war on drugs.

The original post was on February 2nd, 8:26 a.m. eastern time. I’m far from the only person with screenshots, but DM if you would like copies for corroboration.

I checked to see if there was any media coverage of this post and/or its removal but I have found nothing. Even though I was notified to this post existing in other posts on Reddit, this apparently escaped the mainstream media’s attention…"
Donald Trump's MAGA seems to be splitting on the Epstein files more than on any previous controversy that he was involved in. Why is this the trigger? What is it about the list that is causing them to finally break from supporting him?,the_original_Retro,/r/PoliticalDiscussion/comments/1lys6tq/donald_trumps_maga_seems_to_be_splitting_on_the/,"In recent days some of MAGA's more outspoken influencers are rushing to call out the Trump administration's failure to release the unredacted ""Epstein files"", a set of documents that detailed events organized by convicted predator Michael Epstein that, according to his criminal case, included sexual exploitation with numerous underage girls. 

Other influencers and appointees are defending the Trump administration, causing what appears to be a schism in the ""MAGAsphere"". Donald Trump has posted several tweets and made comments in other venues that indicate he wishes this to go entirely away, but instead, the story seems to be gaining traction.

**Why?** What about THIS EVENT seems to be blowing up MAGA more than others? Are numerous media reports on the fraction exaggerated? Why did this trigger a schism when so many of Trump's previous questionable actions have not? Will this go away, or will it continue to build into a full split in the loose ""MAGAsphere""?

\-------------

For background, in February 27. [US DOJ's appointed head Pam Bondi officially released some of the information in the Epstein files as a ""first phase"" and ordered more to be inspected for possible release](https://www.justice.gov/opa/pr/attorney-general-pamela-bondi-releases-first-phase-declassified-epstein-files). Further, a[ press event was organized at the White House where 15 prominent right-wing influencers were given printed copies](https://www.cbsnews.com/news/right-wing-influencers-get-binders-labeled-the-epstein-files-but-downplay-revelations/), but the information they contained was already in the public space, and there was an indication that more was coming.

That information, presumably including a ""celebrity list' that many right-wing social media sources claimed contained the names of many democratic politicians, was not released. Recently, the DOJ and FBI jointly released questionably video footage of Epstein's cell as ""evidence"" that Epstein committed suicide and was not murdered, and claimed that this ""celebrity list"", does not exist.  This has infuriated FBI deputy director Dan Bongino who has accused FBI head Bondi of over-promising and under-delivering on her interactions with this list, and leading to some influencers calling loudly for it to be released while others defend Trump. "
